source,author,title
The Daily Caller,Nicole Silverio,Marco Rubio Shuts Down George Stephanopoulos’ Narrative That Cutting Foreign Aid Killed People
Diepresse.com,Klemens Patek,„Habe sieben Kriege beendet“: Donald Trump sieht Österreich in der „Hölle“ und kämpft mit dem Teleprompter
L'Obs,Pierre Haski,Drones et avions russes : comment Poutine fait progressivement monter la pression sur l’Europe
Le Monde,Elisa Mignot,"Guerre en Ukraine : « J’aimerais rester ici, au calme, protégée par les montagnes »"
STERN.de,STERN.de,"UN-Generaldebatte: Trump über Ukraine-Krieg: ""Europa muss einen Gang zulegen"""
Krone.at,Krone.at,Trump nimmt bei UNO-Rede Österreich in die Mangel
Focus,"FOCUS-online-Redaktion / dpa, Stefan Huber","Erst Baerbock, dann Trump: Heute beginnt Generaldebatte der UN-Vollversammlung"
Thepinknews.com,Alastair James,Queer singer wins Russia’s Eurovision rival Intervision
Der Tagesspiegel,Christopher Stolz,"Ukraine-Invasion, Tag 1307: Daten zeigen, wie effektiv die Angriffe auf russische Ölraffinerien sind"
Le Monde,Le Monde,"En direct, guerre en Ukraine : à l’ONU, Donald Trump appelle les Européens à « arrêter immédiatement » d’acheter du pétrole russe"
DIE WELT,"Celine Babachan,Leonhard Landes",Trump kritisiert europäische Migrationspolitik – und lobt plötzlich Deutschland
Financial Post,Bloomberg News,Rubio Pushes Back on Tusk Threat to Shoot Down Russian Aircraft
tagesschau.de,,Bürgermeister Wegner will alle Ministeriumsposten von Bonn nach Berlin holen
Ndtvprofit.com,Soumil Kamat,"UN General Assembly 2025: Key Speakers, What's On Agenda"
Le Dauphiné Libéré,La rédaction avec AFP,"États-Unis. Guerre en Ukraine, Palestine, immigration... Donald Trump critique l'ONU pendant son discours"
PBS,"Jon Gambrell, Associated Press",4 things to know about Iran’s nuclear program as deadline nears for UN ‘snapback’ sanctions
Hurriyet Daily News,hurriyetdailynews.com,Trump mocks UN on peace and migration in blistering return
New York Magazine,Intelligencer Staff,Trump to Address U.N. General Assembly: Live Updates
The Times of India,ET Online,"China, India and NATO nations are fuelling Russia’s war in Ukraine, says Trump yet again"
Der-postillon.com,Der Postillon,Nach Kritik von Weidel an Putin: Kreml kürzt Parteienfinanzierung für AfD
New York Post,Ryan King,Melania Trump to greet first lady of Ukraine Olena Zelensky at UN
Die Zeit,DIE ZEIT: News -,Verfassungsklage: AfD-Fraktion klagt gegen Haushalt - CDU unterstützt Kritik
Www.dr.dk,,Ekspert peger på russerne: ‘Hvem skulle det ellers være?’
SB Nation,Mike Rutherford,Bruce Pearl’s retirement is as confusing and complicated as his coaching career
Monde-diplomatique.fr,Marc Endeweld,"Entre Kiev et Moscou, l'enjeu du nucléaire"
Diepresse.com,Die Presse,„Habe sieben Kriege beendet“: Donald Trump beginnt Rede vor UNO mit Eigenlob und Teleprompter-Panne
Newser,Jenn Gidman with Newser.AI,Poland to Russia: Don't 'Whine' Over Shot-Down Jets
Roanoke Times,"Lee National Newsroom, The Associated Press",Trump to address UN General Assembly; Kimmel returning to ABC | Hot off the Wire podcast
Richmond.com,"Lee National Newsroom, The Associated Press",Trump to address UN General Assembly; Kimmel returning to ABC | Hot off the Wire podcast
Le Point,Julien Peyron,"« Ne commencez pas une autre guerre » : Radoslaw Sikorski à l’ONU, l’autre discours qui fera date"
Biztoc.com,businessinsider.com,"Ukraine is ready to export its weapons, like the fearsome sea drones that helped it cripple Russia's Black Sea Fleet"
Der Tagesspiegel,Daniel Krause,„Habe euch Marmorböden versprochen“: Trump teilt in kurioser UN-Rede gegen Vereinte Nationen aus – und lobt Deutschland
PBS,Associated Press,"Unidentified drones flew over Copenhagen’s airport, prompting worries Russia could be involved"
Der Tagesspiegel,Der Tagesspiegel,Gaza-Krieg: UN-Experten fordern Israels Ausschluss von Fußballturnieren
DW (English),Isaac Mugabi,African countries seek increased influence at UNGA
DW (English),Isaac Mugabi,African countries want to hold sway at UNGA
STERN.de,STERN.de,Gaza-Krieg: UN-Experten fordern Israels Ausschluss von Fußballturnieren
Die Zeit,DIE ZEIT: News -,Gaza-Krieg: UN-Experten fordern Israels Ausschluss von Fußballturnieren
RT,RT,Violence erupts at Dutch anti-immigration rally (VIDEO)
Business Insider,sbaker@insider.com (Sinéad Baker),"Ukraine is ready to export its weapons, like the fearsome sea drones that helped it cripple Russia's Black Sea Fleet"
Project Syndicate,Kashim Shettima,The Key to Africa’s Clean-Energy Future
Foreign Policy,Gregory H. Fox and Duncan B. Hollis,Is Trump Taking Treaties Back to the Middle Ages?
The Local Germany,Tom Pugh,How generous is Germany's minimum wage really?
Die Zeit,DIE ZEIT: Ausland - Maline Hofmann,UN-Generaldebatte: Baerbock mahnt zu besserer Arbeit der Vereinten Nationen
Biztoc.com,investing.com,Moroccan central bank holds benchmark rate at 2.25%
The Star Online,Emma Farge,"Ukrainian civilians suffer systematic torture in Russian facilities, UN says"
DIE WELT,Celine Babachan,Trumps Rede beginnt mit einer Teleprompter-Panne – und Scherzen
Forbes,"David Hambling, Senior Contributor, 
 David Hambling, Senior Contributor
 https://www.forbes.com/sites/davidhambling/",Giant Robot Submarine Threatens Russia’s Kerch Bridge And Ports
BusinessLine,Our Bureau,France fully supports conclusion of EU-India trade agreement
Boston Herald,Associated Press,Man representing himself against charges of trying to kill Trump will give his closing argument
The Times of India,ET Bureau,"Nayara takes SAP India to court, seeks restoration of software services to raise invoices"
Berliner Morgenpost,Thorsten Knuf,Drohnen über Flughäfen: Eine schmerzhafte Lektion
EURACTIV,Alkistis Damianakou,EU Strategy for the Danube Region – Prosperity through Diversity
OilPrice.com,Felicity Bradstock,The EU Remains the World's Biggest Buyer of Russian Gas Despite Sanctions
DIE WELT,Celine Babachan,Baerbock eröffnet UN-Generaldebatte – gleich spricht Trump
DW (English),Deutsche Welle,"Haushalt 2026: Deutschland vor ""anstrengenden"" Reformen"
RT,RT,Ukraine has to agree to peace deal – Rubio
CNA,,NATO warns Russia to stop air violations over eastern members
Forbes,"Sara Dorn, Forbes Staff, 
 Sara Dorn, Forbes Staff
 https://www.forbes.com/sites/saradorn/",Trump Expected To Criticize UN In First General Assembly Speech Since 2019
Diepresse.com,Die Presse,UN-Generalversammlung im Livestream: Donald Trumps beginnt seine große Rede
Fair Observer,Kyle Moran,FO° Talks: Donald Trump’s Tariffs Could Boomerang and Unite the BRICS Nations
Biztoc.com,breakingthenews.net,"US opens mostly flat with UNGA, data in focus"
Celebitchy.com,Kaiser,Times: Prince William ‘earned his stripes as a global statesman last year’???
Monde-diplomatique.fr,Pierre Rimbert,L'Ukraine et ses faux amis
The Denver Post,The Associated Press,"Watch live: Trump to take aim at ‘globalist institutions,’ make case for his foreign policy record in UN speech"
Boston Herald,Associated Press,"Trump to take aim at ‘globalist institutions,’ make case for his foreign policy record in UN speech"
Sputnikglobe.com,Sputnik International,"Rubio Says UN 'Playing No Role' in Resolving Ukraine Conflict, Trump Carries All Burden"
RT,RT,Trump USAID cuts doom Ukrainian dog cartoon
Al Jazeera English,"Al Jazeera Staff, News Agencies","NATO warns Russia of airspace violations, will defend self, deter threats"
Sputnikglobe.com,Sputnik International,Russia Troops Successfully Completing Task of Taking Control of Kupyansk - MoD
Life.ru,Алиса Хуссаин,НАТО инвестирует $728 млн в развитие космических технологий
STERN.de,STERN.de,Baerbock eröffnet 80. UN-Generaldebatte in New York
Yahoo Entertainment,Reuters Videos,Russia targets Ukraine's railways with 'systematic' attacks - CEO
GlobeNewswire,Diana Shipping Inc. c/o Diana Shipping Services S.A.,Diana Shipping Inc. Announces Time Charter Contract for m/v Leonidas P. C. with NYK
Commercial Observer,Tacitelli,International Flight: The Shifts in U.S. Condo Sales to Foreign Buyers
Der Tagesspiegel,Der Tagesspiegel,Krieg in der Ukraine: Moskau reklamiert Kontrolle über Großteil der Stadt Kupjansk
The Irish Times,Gram Slattery in New York,Trump to address UN as he distances US from global cooperation
Die Zeit,DIE ZEIT: News -,Krieg in der Ukraine: Moskau reklamiert Kontrolle über Großteil der Stadt Kupjansk
STERN.de,STERN.de,Krieg in der Ukraine: Moskau reklamiert Kontrolle über Großteil der Stadt Kupjansk
HuffPost,AP,"Trump To Take Aim At 'Globalist Institutions,' Make Case For His Foreign Policy Record In UN Speech"
Diepresse.com,Die Presse,UN-Generalversammlung gestartet: Donald Trumps große Rede im Livestream
The Indian Express,Ajay Darshan Behera,What the Saudi-Pakistan pact means for India — and global politics
International Business Times,Umberto BACCHI,EU Proposes New Delay To Anti-deforestation Rules
tagesschau.de,,Wie funktioniert der Schutz des NATO-Luftraums?
The Irish Times,Naomi O’Leary,Donald Trump to address world leaders in New York
RT,RT,Polish activist dies fighting Ukrainian ‘neo-Nazis’ – officials
Monde-diplomatique.fr,Christophe Trontin,"En Russie, le mot « guerre » n'est plus tabou"
Freitag.de,Eric Bonse,Gaza | Israel-Sanktionen: Was die EU plant und warum es kaum Wirkung zeigen wird
OilPrice.com,Tsvetana Paraskova,Russia Considers Extending Gasoline Export Ban As Fuel Crisis Worsens
Berliner Morgenpost,FUNKE Mediengruppe,Nato einfach erklärt: Das ist Artikel 4 des Nordatlantikvertrags
Biztoc.com,breakingthenews.net,Rubio hopes US can help stop Ukraine conflict
Der Tagesspiegel,Der Tagesspiegel,Hauptstadt-Debatte: Komplett-Umzug nach Berlin? - „Fake News!“
Diepresse.com,Jutta Sommerbauer,Russische Drohnen nehmen jetzt das ukrainische Schienennetz verstärkt ins Visier [premium]
BFMTV,,Guerre en Ukraine: deux morts après de nouvelles frappes nocturnes russes
STERN.de,STERN.de,"Hauptstadt-Debatte: Komplett-Umzug nach Berlin? - ""Fake News!"""
ABC News,LORNE COOK Associated Press,NATO warns Russia it will use all means to defend against airspace breaches
C21media.net,A A,"Moonvalley, Particle6, Deep Fusion Films, Karmanline, Virgin Media Television and Charismatic.ai to discuss how gen AI is supercharging the New Content Economy at Content London’s AI Festival"
Kino.de,Susan Engels,"Verließ ""GZSZ"" vor 10 Jahren: Das wurde aus der ""Mieze""-Darstellerin"
BBC News,BBC Sport,When is NFL Dublin and who is playing?
Eleconomista.es,elEconomista.es,easyJet asciende al español Javier Gándara a director global de Políticas Públicas
Metal Injection.net,Greg Kennelty,"Watch SLAYER's Entire Hershey, PA Show From Over The Weekend"
The Points Guy,Danyal Ahmed,10 TPG-recommended items to buy with your $75 Amex Platinum Lululemon credit before Q3 ends
Mile High Report,Scotty Payne,Broncos have a favorable schedule moving forward
Diepresse.com,Klemens Patek,„Habe sieben Kriege beendet“: Donald Trump sieht Österreich in der „Hölle“ und kämpft mit dem Teleprompter
Bild,Sönke Schulenburg,Stellenanzeige im Auftrag der Krone - König Charles sucht Honorarkonsul für Hannover
La Nacion,Martín De Ambrosio,¿Cuándo tendrá conciencia? La pregunta sobre Inteligencia Artificial que desvela a expertos en un foro internacional
Il Sole 24 Ore,di Marta Casadei,Il passaporto digitale del prodotto in passerella a Londra con McDowell e Certilogo
Exclaim!,Karlie Rogers,Lights Books North American Tour
DIE WELT,"Celine Babachan,Leonhard Landes",Trump kritisiert europäische Migrationspolitik – und lobt plötzlich Deutschland
Biztoc.com,forbes.com,"A look at London-based “neocloud” startup Nscale, which landed a $500M investment from Nvidia and aims to scale up to 300K GPUs globally, on par with CoreWeave"
Forbes,"Tim Lammers, Contributor, 
 Tim Lammers, Contributor
 https://www.forbes.com/sites/timlammers/",What Time Does Gary Oldman’s ‘Slow Horses’ Season 5 Begin Streaming?
DJ Mag,Kelly Doherty,SMUT is my religion: How a DIY publisher became one of London’s best queer parties
Cityxtra.co.uk,,"Huddersfield Town vs Manchester City (Carabao Cup Third Round): Match Preview, Team News, Head to Head, How To Watch"
Order-order.com,Eleanor Wheatley,WATCH: Trump Slams Sadiq Khan in Speech to Global Leaders
The Star Online,The Star Online,UK loses appeal over block on removal of asylum seeker under UK-France deal
TelecomTV,TelecomTV Staff,"What’s up with… Network APIs, UK altnets, TalkTalk"
The Times of India,PTI,"High-level delegation visits UK to deepen trade textile trade, leverage CEPA"
GlobeNewswire,Sampo Oyj,Sampo plc announces results of the tender offers for its subordinated notes due in 2052 and 2049
GlobeNewswire,Sampo Oyj,Sampo Oyj julkistaa 2052 ja 2049 erääntyviä huonomman etuoikeuden joukkovelkakirjalainojaan koskevien takaisinostotarjousten tuloksen
Ra.co,Michael Lawson,Resident Advisor to take part in charity ADE Cycle 2025
Algoafm.co.za,Algoafm South Africa,Buffalo City strike raises fears of jobs lost to automation
Portfolio.hu,Portfolio.hu,Felfedte Donald Trump: példátlan veszély fenyegeti az emberiség jövőjét
Harvard Business Review,,"Steven Pinker on Speculation Bubbles, Super Bowl Ads, and What Leaders Need to Know About Group Psychology"
New York Magazine,Intelligencer Staff,Trump to Address U.N. General Assembly: Live Updates
Insurance Journal,admin,Bank of England’s Bailey Says AI Can Help Regulators to Find the ‘Smoking Gun’
Independent.ie,Ellie Ng,Duchess of York sent Epstein email ‘after he threatened to destroy her family’
Pitchfork,Nina Corcoran,"The Fiery Furnaces Announce Blueberry Boat Vinyl Reissue, Share New Song: Listen"
Time Out,Primary Author: Joe Mackertich,"Time Out’s Love Thy Neighbourhood podcast is back for a third season, with Jameela Jamil, Adam Buxton, Nick Mohammed and more"
Expressen.se,cesar.faltskar@expressen.se (Cesar Fältskär),Kaos under Trumps tal
Deadline,Greg Evans,‘Evita’ Actor Diego Andres Rodriguez Signs With Anonymous Content
Diepresse.com,Die Presse,„Habe sieben Kriege beendet“: Donald Trump beginnt Rede vor UNO mit Eigenlob und Teleprompter-Panne
WWD,Lily Templeton,EXCLUSIVE: Luis de Javier’s Spring 2026 Reveal Will Take 24 Hours
Rolling Stone,Jeff Ihaza,A Close Reading of Drake’s Enigmatic ‘Iceman’ Live Streams
Rolling Stone,Jeff Ihaza,A Close Reading of Drake’s Enigmatic ‘Iceman’ Livestreams
SPIN,Ade Adeniji,October London Is Reviving Death Row’s Original Multigenre Vision
NBCSports.com,Mike Florio,"Superdome lease negotiations stall, due to related deals"
CNBC,,Amazon to close all of its Fresh grocery stores in UK
BBC News,,Home Office loses bid to overturn court order blocking migrant's removal
Biztoc.com,newsweek.com,"Woman Films OOTD, Watches Footage Back and Realizes She Wasn’t Alone"
TechCrunch,Lorenzo Franceschi-bicchierai,European airports still dealing with disruptions days after ransomware attack  | TechCrunch
Biztoc.com,techcrunch.com,European airports still dealing with disruptions days after ransomware attack
Screen Rant,Stephen Holland,10 Must-Watch Biopics That Capture Extraordinary Lives On Screen
Der Tagesspiegel,Daniel Krause,„Habe euch Marmorböden versprochen“: Trump teilt in kurioser UN-Rede gegen Vereinte Nationen aus – und lobt Deutschland
MetalSucks,Hesher Keenan,Testament’s Alex Skolnick Says “It Would Be Great” to Go on Tour with Metallica
The Irish Times,Aisha S Gani,Revolut to spend €11.5bn on push for 100m users
BBC News,Stephan Shemilt,'Bird became cricket legend without scoring a run for England'
Time Out,Primary Author: Hannah Bentley,An official Pokémon shop is coming to London’s Natural History Museum
road.cc,Dan Alexander,"New 'dangerous cycling' laws are on the way, but government confirms ""no plans"" to make speed limits apply to cyclists"
Celebitchy.com,Kaiser,"Edward Enninful won’t work with Duchess Meghan again, doesn’t want to ‘repeat myself’"
BBC News,,Fact-checking claims Trump made about autism
BBC News,Matt Murphy,Fact-checking three claims Trump made about autism
Science.orf.at,ORF.at,Lange Entschuldigungen wirken besser
WWD,Sofia Celeste,Italian Wall Covering Firm Fabscarte and Chinese Fashion Brand Deepmoss Strengthen Partnership
Financial Post,Business Wire,Behavox Launches Pathfinder Policy Manager to Automate Compliance and Accelerate Front-Office Productivity
Exystence.net,exy,Mark William Lewis – Mark William Lewis (2025)
Financial Post,GlobeNewswire,Hong Kong Tourism Board Celebrates Arts and Culture With Art Toronto
Biztoc.com,observer.com,"The Frick Legacy: Taste, Ambition and a Collector’s Monument"
GlobeNewswire,Hong Kong Tourism Board Canada,Hong Kong Tourism Board Celebrates Arts and Culture With Art Toronto
The Times of India,Gandharv Walia,"Ed Sheeran Net Worth and Loop Tour 2026 Presale: Music career, earnings from albums, tours and business ventures, properties, complete dates and venues, how to get tickets?"
TechRadar,Tom Wardley,"How to watch RuPaul's Drag Race UK season 7 online – stream every laugh, lewk and lip-sync for free"
Acmilan.com,,AC MILAN AND FC INTERNAZIONALE MILANO ANNOUNCE COLLABORATION WITH FOSTER + PARTNERS AND MANICA FOR THE NEW MILAN STADIUM
STAT,Andrew Joseph,Europe pushes back on Trump's Tylenol autism warning
Brigitte.de,https://www.facebook.com/brigitte,Abseits der Runways: Das sind die neuesten Trends auf den Straßen der London Fashion Week
Econlib.org,Pierre Lemieux,The Liberal 19th Century
Observer,"Megan Fox Kelly, Megan Fox Kelly","The Frick Legacy: Taste, Ambition and a Collector’s Monument"
Celebitchy.com,Kaiser,"Prince Harry appears in a UNAIDS video, with a stark warning about the AIDS crisis"
Berliner Morgenpost,Katrin Lange,Wie zwei Fotografinnen von Steglitz aus die Welt eroberten
GlobeNewswire,Oritain Global Limited,Oritain Extends Cutting-Edge Origin Verification to Leather for EUDR Readiness
Plos.org,"Louis Tunnicliffe, Rutendo Muzambi, Jonathan W. Bartlett, Laura D. Howe, Khalid A. Basit, Kwabena Asare, Georgia Gore-Langton, Kathryn E. Mansfield, Veryan Codd, Charlotte Warren-Gash",Infection and telomere length: A systematic review
Plos.org,"Eirlys J. Pijpers, Bart Bloemen, Wija J. Oortwijn, Baziel G. M. van Engelen, Gert Jan van der Wilt, Jan T. Groothuis, Edith H. C. Cup",Effectiveness of the capability approach in rehabilitation for persons with neuromuscular diseases: A controlled before-after study
Plos.org,"Jessica Dunoyer, Ruwan Ratnayake, Sandy Moore, Gregory Bulit, Samuel Beaulieu, Christophe Valingot, Pierre-Yves Oger, Bertrand Sudre, Daniele Lantagne, Nicola Desmond",Optimizing the implementation of case-area targeted interventions during cholera outbreaks with context-specific delivery mechanisms
Inter.it,,Inter and AC Milan announce collaboration with Foster + Partners and MANICA for the new Milano stadium
Rigzone,Mitchell Ferman,BP Halts Plans to Build Biofuels Plant in the Netherlands
Steynonline.com,Mark Steyn,"When the ""Nice People"" Want to Kill You"
COMPUTER BILD,Przemyslaw Szymanski,Kratzer beim iPhone 17 – diese Farben sollen besonders anfällig sein
The Times of India,ET Online,"When two Indian brothers hid in a plane’s landing gear to reach the UK; one survived the 4000 mile journey at 40,000 ft in -60°C"
Lse.ac.uk,Blog Admin,Who is liable for AI? With Dr Anat Lior | The Ballpark podcast
Biztoc.com,finance.yahoo.com,"Revolut weighs buying US bank in global expansion push, executive says"
Yahoo Entertainment,Karin Strohecker,Argentina markets extend stellar rebound ahead of expected Trump-Milei meeting
WWD,Tianwei Zhang,"Shushu/Tong, Mark Gong, Oude Waag to Headline Shanghai Fashion Week"
BBC News,,Attacker of Quran-burning protestor is spared jail
Finextra,Editorial Team,Folk2Folk appoints new CEO
Thepinknews.com,Alastair James,Simon Amstell bares all for new stand-up show posters
Time Out,Primary Author: Leonie Cooper,The floating east London restaurant that is officially one of the most unique places to eat in the world
decanter.com,Neil Ridley,Laphroaig announces new celebrity partnership
Just-food.com,Simon Harvey,Vegan Food Group CEO Dave Sparrow confirms resignation
Forbes,"Felipe Schrieberg, Senior Contributor, 
 Felipe Schrieberg, Senior Contributor
 https://www.forbes.com/sites/felipeschrieberg/",Laphroaig Announces Willem Dafoe Collaboration And New Whisky
RTE,RTÉ News,Revolut pledges £3 billion new investment in UK
BBC News,James Jones,'Another self-inflicted crossroads'
Biztoc.com,fortune.com,"TikTok’s CEO used to work for Mark Zuckerberg as a Facebook intern. Just one decade later, he’s become one of Meta’s fiercest competitors"
Lse.ac.uk,Blog Team,"Europe, Palestine and the meaning of recognition"
Celebitchy.com,Kaiser,Times: Prince William ‘earned his stripes as a global statesman last year’???
